{
  "$schema": "http://json-schema.org/draft-07/schema#",
  "$id": "https://vahinitech.com/schemas/recognition-ladders.schema.json",
  "title": "Recognition ladders",
  "description": "The stages that may read a line of each script, cheapest first, per OCR mode (docs/20-languages.md, section 17.2). Built by scripts/rank_stages.py from stages.json; never edited by hand.",
  "type": "object",
  "additionalProperties": false,
  "required": ["version", "stages_sha256", "device", "modes"],
  "properties": {
    "$comment": {"type": "string"},
    "version": {"const": 1},
    "stages_sha256": {
      "description": "sha256 of the stages.json the ladders were built from. The server refuses to start when it differs from the stages.json it loads.",
      "type": "string",
      "pattern": "^[0-9a-f]{64}$"
    },
    "device": {
      "description": "The device every rung runs on (section 17.8, item 4).",
      "enum": ["cpu", "gpu"]
    },
    "modes": {
      "type": "object",
      "additionalProperties": false,
      "required": ["paddle", "trocr", "hybrid"],
      "properties": {
        "paddle": {"$ref": "#/definitions/mode"},
        "trocr": {"$ref": "#/definitions/mode"},
        "hybrid": {"$ref": "#/definitions/mode"}
      }
    }
  },
  "definitions": {
    "script": {"type": "string", "pattern": "^[A-Z][a-z]{3}$"},
    "stageId": {"type": "string", "pattern": "^[a-z0-9]+(-[a-z0-9]+)*$"},
    "mode": {
      "type": "object",
      "additionalProperties": false,
      "required": ["read"],
      "properties": {
        "read": {
          "type": "object",
          "minProperties": 1,
          "propertyNames": {"$ref": "#/definitions/script"},
          "additionalProperties": {"$ref": "#/definitions/ladder"}
        }
      }
    },
    "ladder": {
      "type": "object",
      "additionalProperties": false,
      "required": ["basis", "rungs"],
      "properties": {
        "basis": {
          "description": "reader: the reader that found the line, alone (paddle mode). pinned: TrOCR re-reads every line whatever its script (trocr mode). route: the route in stages.json, kept while a stage's quality or cost is unmeasured. ranked: built from measured facts by the rules of section 17.2.",
          "enum": ["reader", "pinned", "route", "ranked"]
        },
        "rungs": {
          "type": "array",
          "minItems": 1,
          "uniqueItems": true,
          "items": {"$ref": "#/definitions/stageId"}
        },
        "left_off": {
          "description": "Stages that could read this script but are not on the ladder, and why.",
          "type": "object",
          "propertyNames": {"$ref": "#/definitions/stageId"},
          "additionalProperties": {"type": "string", "minLength": 1}
        },
        "unmeasured": {
          "description": "Stages whose quality or cost for this script is not measured, so the ladder could not be ranked.",
          "type": "array",
          "uniqueItems": true,
          "items": {"$ref": "#/definitions/stageId"}
        }
      }
    }
  }
}
